{
  "schema_version": "1.1.0",
  "artifact_type": "analysis_contract",
  "contract_id": "ctr-imaging-evaluation",
  "profile": {
    "analysis_mode": "confirmatory",
    "assurance": "standard",
    "autonomy": "collaborative"
  },
  "objective": "Evaluate the locked pulmonary-embolism classifier on an external hospital cohort at the participant level.",
  "questions": [
    {
      "question_id": "q-external-performance",
      "text": "Does the locked classifier meet prespecified discrimination, calibration, and sensitivity criteria externally?"
    }
  ],
  "inputs": [
    {
      "input_id": "ct-exams",
      "role": "primary_data",
      "required": true,
      "description": "Eligible contrast-enhanced chest CT examinations with participant identifiers and acquisition metadata."
    },
    {
      "input_id": "locked-model",
      "role": "model",
      "required": true,
      "description": "Frozen model weights, preprocessing definition, operating threshold, and software environment."
    }
  ],
  "design": {
    "study_type": "external diagnostic model evaluation",
    "analysis_unit": "participant",
    "units": [
      {
        "unit_id": "participant",
        "description": "Independent participant used for splitting and primary inference."
      },
      {
        "unit_id": "ct-exam",
        "description": "Eligible CT examination nested within a participant.",
        "parent_unit_id": "participant"
      }
    ],
    "outcomes": [
      {
        "outcome_id": "pulmonary-embolism",
        "role": "primary",
        "definition": "Adjudicated presence or absence of acute pulmonary embolism.",
        "unit_id": "participant"
      }
    ],
    "analysis_sets": [
      {
        "analysis_set_id": "external-test-set",
        "unit_id": "participant",
        "definition": "Consecutive eligible participants from the external hospital with an adjudicated reference standard."
      }
    ],
    "factors": [],
    "contrasts": [],
    "covariates": ["scanner-vendor", "sex", "age-group"]
  },
  "governance": {
    "human_subjects": "yes",
    "animals": "no",
    "sensitive_data": "yes",
    "hazardous_materials": "no",
    "approvals": ["IRB approval or exemption must cover external model evaluation."],
    "restrictions": ["Retain DICOM and identifiers in approved clinical storage."]
  },
  "steps": [
    {
      "step_id": "lock-evaluation",
      "purpose": "Confirm model, preprocessing, threshold, test cohort, and metrics were fixed before evaluation.",
      "method": "Signed evaluation manifest and participant-level cohort ledger."
    },
    {
      "step_id": "evaluate-model",
      "purpose": "Estimate discrimination, calibration, operating-point performance, and subgroup uncertainty.",
      "method": "Participant-level metrics with bootstrap confidence intervals and calibration assessment."
    }
  ],
  "required_outputs": [
    {
      "output_id": "imaging-model-metrics",
      "kind": "table",
      "description": "Primary and subgroup metrics with confidence intervals and denominators."
    },
    {
      "output_id": "calibration-figure",
      "kind": "figure",
      "description": "Calibration display with source data and uncertainty."
    }
  ],
  "validation": [
    {
      "check_id": "participant-split-integrity",
      "criterion": "No participant appears in model development and external evaluation data.",
      "severity": "error"
    }
  ],
  "constraints": [],
  "audiences": ["clinical_investigator", "model_reviewer"],
  "extensions": {
    "profiles": {
      "medical_imaging_model_evaluation": {
        "intended_use": "Flag suspected pulmonary embolism on contrast-enhanced chest CT for radiologist prioritization.",
        "modality": "Contrast-enhanced chest CT.",
        "task": "classification",
        "clinical_unit": "participant",
        "split_unit": "participant",
        "reference_standard": "Independent adjudication by two thoracic radiologists with consensus resolution.",
        "external_validation_axis": ["hospital", "scanner-vendor"],
        "reader_study": false,
        "abstention_allowed": true
      }
    }
  }
}
