{
  "schema_version": "1.1.0",
  "artifact_type": "analysis_contract",
  "contract_id": "ctr-cross-domain",
  "profile": {
    "analysis_mode": "confirmatory",
    "assurance": "strict",
    "autonomy": "approval_required"
  },
  "objective": "Estimate the prespecified lesion measurement under the approved imaging protocol.",
  "questions": [
    {
      "question_id": "q-lesion-measurement",
      "text": "What is the prespecified lesion measurement for each eligible participant?"
    }
  ],
  "inputs": [
    {
      "input_id": "image-series",
      "role": "primary_data",
      "required": true,
      "description": "Approved clinical image series identified in the institutional archive."
    }
  ],
  "design": {
    "study_type": "retrospective observational",
    "analysis_unit": "participant",
    "units": [
      {
        "unit_id": "participant",
        "description": "Independent enrolled participant."
      },
      {
        "unit_id": "lesion",
        "description": "Lesion measured within a participant.",
        "parent_unit_id": "participant"
      }
    ],
    "outcomes": [
      {
        "outcome_id": "lesion-volume",
        "role": "primary",
        "definition": "Lesion volume measured once using the locked procedure.",
        "unit_id": "lesion"
      }
    ],
    "analysis_sets": [
      {
        "analysis_set_id": "eligible-participants",
        "unit_id": "participant",
        "definition": "Participants satisfying the approved eligibility criteria with an interpretable image series."
      }
    ],
    "factors": [],
    "contrasts": [],
    "covariates": []
  },
  "governance": {
    "human_subjects": "yes",
    "animals": "no",
    "sensitive_data": "yes",
    "hazardous_materials": "no",
    "approvals": ["IRB approval status must be confirmed before execution."],
    "restrictions": ["Process identifiable images only in the approved controlled environment."]
  },
  "steps": [
    {
      "step_id": "measure-lesions",
      "purpose": "Measure the prespecified primary outcome.",
      "method": "Locked institutional lesion-measurement procedure."
    }
  ],
  "required_outputs": [
    {
      "output_id": "measurement-results",
      "kind": "data",
      "description": "Controlled collection of participant-level measurement records."
    }
  ],
  "validation": [
    {
      "check_id": "eligible-only",
      "criterion": "Every measurement belongs to the eligible-participants analysis set.",
      "severity": "error"
    }
  ],
  "constraints": [
    {
      "constraint_id": "controlled-environment",
      "kind": "policy",
      "text": "All identifiable inputs and outputs remain in the approved controlled environment."
    }
  ],
  "audiences": ["scientific_peer"],
  "strict_policy": {
    "require_lockfile": false,
    "require_container": false,
    "require_fixed_references": false,
    "require_cached_sources": false,
    "require_rerun": false,
    "numeric_tolerance": 0
  },
  "extensions": {
    "profiles": {
      "imaging.measurement": {
        "modality": "example"
      }
    }
  }
}
